slide_number,slide_title,slide_text,speaker_notes,has_notes,notes_word_count,slide_text_word_count,image_filename,context_slides_used,ai_transcript,knowledge_chunks_used,knowledge_sources,knowledge_sections,knowledge_search_query,avg_knowledge_score
1,Llamas: Fascinating Animals of the Andes,"Llamas: Fascinating Animals of the Andes
An Overview of Their Life, Behavior, and Role","Welcome everyone! Today, we're going to explore the fascinating world of llamas, unique animals deeply intertwined with human history and culture in the Andes Mountains of South America. Let's discover why they're so remarkable.",True,34,14,slide-001.png,0.0,"Llamas are unique animals deeply intertwined with human history and culture in the Andes Mountains of South America. Native to this region, they are primarily found in Peru, Bolivia, Ecuador, Chile, and Argentina. Llamas were domesticated in the Andes around four thousand to five thousand years ago and played a central role in the development of early Andean civilizations, including the Inca Empire. They were used for transportation and other purposes. Today, llamas are not endangered and are widely bred and maintained both in South America and globally. Let's discover why they're so remarkable.",5.0,llamas.md,"Distribution and Habitat, References, Domestication and Historical Use, Llamas (*Lama glama*), Conservation Status","Llamas: Fascinating Animals of the Andes Welcome everyone! Today, we're going to explore the fascinating world of llamas, unique animals deeply intertwined with human history and culture in the Andes ...",0.7308
2,Introduction to Llamas,"Introduction to Llamas
Definition: A domesticated South American camelid.
Scientific Name: Lama glama.
Origin: Andes Mountains, South America.
Related Species: Alpacas, Guanacos, Vicuñas (wild relatives).","Llamas were domesticated thousands of years ago. They descend from wild camelids native to South America and share their habitat with related species like alpacas, guanacos, and vicuñas.",True,28,25,slide-002.png,1.0,"A llama is defined as a domesticated South American camelid, with the scientific name Lama glama. Originating from the Andes Mountains in South America, llamas share their habitat with related species such as alpacas, guanacos, and vicuñas, which are their wild relatives. Domesticated thousands of years ago, llamas descend from wild camelids native to this region. Their history and relationship with other camelid species highlight their significance in South American culture and ecology.",5.0,llamas.md,"Llamas (*Lama glama*), Distribution and Habitat, References, Conservation Status, Taxonomy","Introduction to Llamas Llamas were domesticated thousands of years ago. They descend from wild camelids native to South America and share their habitat with related species like alpacas, guanacos, and...",0.7962
3,Physical Characteristics,"Physical Characteristics
Height: ~5.5 to 6 feet tall at the head.
Weight: 280-450 pounds (127-204 kg).
Coat: Soft, woolly fiber available in various colors.
Adaptations: Large lungs, efficient oxygen use at high altitudes.","Llamas are well adapted to life in harsh mountain environments, with thick coats protecting them from the cold and specialized respiratory adaptations that allow survival at high elevations.",True,28,33,slide-003.png,2.0,"Llamas have several distinct physical characteristics that enable them to thrive in their native environments. They typically stand between five point five to six feet tall at the head and weigh between two hundred eighty to four hundred fifty pounds, or one hundred twenty-seven to two hundred four kilograms. Their coat is made of soft, woolly fiber that comes in various colors. One of their most significant adaptations is their large lungs and efficient oxygen use, which allows them to survive at high altitudes. These physical traits are crucial for their survival in harsh mountain environments, where thick coats protect them from the cold. We'll explore how these adaptations contribute to their overall hardiness in the next section.",5.0,llamas.md,"Health and Care, Distribution and Habitat, Conservation Status, Behavior and Social Structure, Diet and Digestion","Physical Characteristics Llamas are well adapted to life in harsh mountain environments, with thick coats protecting them from the cold and specialized respiratory adaptations that allow survival at h...",0.6936
4,Diet & Habitat,"Diet & Habitat
Diet: Herbivorous; grasses, hay, grains, leaves.
Habitat: Semi-arid regions, high-altitude grasslands (Altiplano).
Water Needs: Require regular access to clean water.","Llamas have a simple but nutritious diet. Their feeding habits make them ideal animals for regions where food can be sparse, demonstrating their adaptability.",True,24,23,slide-004.png,3.0,"Llamas are herbivorous animals with a diet consisting of grasses, hay, grains, and leaves. They inhabit semi-arid regions and high-altitude grasslands, known as the Altiplano. These animals require regular access to clean water to thrive. Their simple yet nutritious diet makes them well-suited for regions where food resources may be limited, showcasing their adaptability to various environments.",5.0,"llamas.md, llama diet.md","Diet and Digestion, Health and Care, Conservation Status, Behavior and Social Structure","Diet & Habitat Llamas have a simple but nutritious diet. Their feeding habits make them ideal animals for regions where food can be sparse, demonstrating their adaptability.",0.7428
5,Behavior & Social Structure,"Behavior & Social Structure
Social Nature: Highly social herd animals.
Communication: Use humming, ear positioning, body language.
Defensive Behavior: Spitting when threatened or stressed.
Hygiene Habits: Create communal dung piles.","Llamas have a sophisticated social structure. They communicate effectively through subtle signals and body language. Contrary to popular belief, llamas only spit as a last resort when feeling threatened or irritated.",True,31,30,slide-005.png,4.0,"Llamas are highly social herd animals with a sophisticated social structure. They communicate effectively through various methods, including humming, ear positioning, and body language. When it comes to defense, llamas typically spit when they feel threatened or stressed, though this behavior is often misunderstood and occurs less frequently than popularly believed. Interestingly, llamas also exhibit unique hygiene habits by creating communal dung piles. These behaviors highlight their complex social interactions and adaptability to their environments. We'll explore how these traits contribute to their overall nature and usefulness as pack animals in the next section.",5.0,llamas.md,"Behavior and Social Structure, Llamas in Popular Culture, Diet and Digestion, Llamas (*Lama glama*), Health and Care","Behavior & Social Structure Llamas have a sophisticated social structure. They communicate effectively through subtle signals and body language. Contrary to popular belief, llamas only spit as a last ...",0.615
6,Breeding & Life Cycle,"Breeding & Life Cycle
Gestation: Approximately 11.5 months.
Cria: Name given to newborn llamas.
Early Life: Standing and nursing shortly after birth.
Lifespan: Typically 15-25 years.","Llamas have a relatively long gestation period, producing typically one offspring (cria) per year. Newborn llamas are quick to stand and nurse, vital for survival in challenging environments.",True,28,26,slide-006.png,5.0,"Llamas have a gestation period of approximately eleven dot five months, after which they typically give birth to a single offspring, known as a cria. Newborn llamas are remarkable for their ability to stand and nurse shortly after birth, a crucial adaptation for survival in challenging environments. The average lifespan of a llama ranges from fifteen to twenty-five years, allowing them to form long-term bonds within their social groups. This life cycle is essential to understanding their behavior and social structure, which we'll explore further in subsequent sections.",5.0,llamas.md,"Reproduction and Lifespan, Health and Care, Conservation Status, Behavior and Social Structure, Distribution and Habitat","Breeding & Life Cycle Llamas have a relatively long gestation period, producing typically one offspring (cria) per year. Newborn llamas are quick to stand and nurse, vital for survival in challenging ...",0.616
7,Historical & Cultural Significance,"Historical & Cultural Significance
Domestication: Occurred 4,000-5,000 years ago.
Uses Historically: Transport, wool, food, rituals.
Cultural Role: Symbolic importance in Andean cultures.","Llamas have been integral to the Andean way of life for thousands of years. They were central to trade, transportation, clothing production, and had spiritual significance to indigenous communities.",True,29,22,slide-007.png,5.0,"Llamas have been integral to the Andean way of life for thousands of years, with their domestication occurring between four thousand to five thousand years ago. Historically, they were used for transport, wool production, food, and played a significant role in various rituals. Their cultural role extends beyond practical uses, holding symbolic importance in Andean cultures. They were central to trade, transportation, clothing production, and had spiritual significance to indigenous communities, highlighting their multifaceted impact on the region's history and identity.",5.0,llamas.md,"Domestication and Historical Use, Economic and Cultural Importance, Distribution and Habitat, Llamas in Popular Culture, Llamas (*Lama glama*)","Historical & Cultural Significance Llamas have been integral to the Andean way of life for thousands of years. They were central to trade, transportation, clothing production, and had spiritual signif...",0.6966
8,Modern Uses of Llamas,"Modern Uses of Llamas
Fiber Production: High-quality wool for textiles.
Pack Animals: Popular in hiking and trekking tourism.
Therapy Animals: Gentle temperament makes them suitable.
Guard Animals: Effective protectors of sheep and goats from predators.","Today, llamas have diversified roles. Their gentle nature makes them beloved as therapy animals, while their strength and wool continue to make them economically valuable in various industries.",True,28,35,slide-008.png,5.0,"Llamas continue to serve multiple purposes in modern times. Their versatility is evident in several key areas. First, their fiber production provides high-quality wool for textiles, leveraging their soft, woolly coats that we discussed earlier. Second, they remain popular as pack animals, particularly in hiking and trekking tourism, where their strength and endurance prove invaluable. Additionally, their gentle temperament makes them suitable as therapy animals, offering comfort and companionship. Lastly, llamas are effective guard animals, protecting sheep and goats from predators due to their alert nature and protective instincts. This diversification of roles underscores their ongoing importance and value across various industries and applications.",5.0,llamas.md,"Economic and Cultural Importance, Health and Care, Llamas (*Lama glama*), Domestication and Historical Use, Behavior and Social Structure","Modern Uses of Llamas Today, llamas have diversified roles. Their gentle nature makes them beloved as therapy animals, while their strength and wool continue to make them economically valuable in vari...",0.7373999999999999
9,Conservation & Welfare,"Conservation & Welfare
Conservation: Focus on wild relatives like guanacos, vicuñas.
Threats: Habitat loss, climate change impact ecosystems.
Ethical Care: Importance of proper shearing, humane living conditions, veterinary care.","Although domesticated llamas are not endangered, ethical farming practices are crucial. Conservation efforts focus mainly on wild camelids threatened by human activities and environmental changes.",True,25,29,slide-009.png,5.0,"Conservation efforts related to llamas primarily focus on their wild relatives, such as guanacos and vicuñas. These wild camelids face significant threats, including habitat loss and the impacts of climate change on their ecosystems. It's essential to address these challenges to preserve the genetic diversity and natural habitats of these species. In addition to conservation, ethical care is vital for the well-being of llamas. This includes proper shearing techniques to prevent discomfort and health issues, providing humane living conditions that cater to their behavioral and physical needs, and ensuring they receive appropriate veterinary care. By adopting these practices, we can promote the welfare of llamas and their wild counterparts, ultimately supporting their continued health and survival. Although domesticated llamas are not currently endangered, these ethical farming practices remain crucial for their overall well-being.",5.0,llamas.md,"Conservation Status, Economic and Cultural Importance, Llamas (*Lama glama*), Health and Care, References","Conservation & Welfare Although domesticated llamas are not endangered, ethical farming practices are crucial. Conservation efforts focus mainly on wild camelids threatened by human activities and env...",0.7
10,Conclusion & Fun Facts,"Conclusion & Fun Facts
Intelligent & Curious: Highly trainable and inquisitive.
Strength: Can carry approximately 25-30% of their body weight.
Community Impact: Sustainable farming supports local economies and ecosystems.","To wrap up, llamas are extraordinary animals, intelligent, strong, and culturally significant. By supporting responsible llama farming, we contribute positively to local economies and ecosystems. Thank you, and I’d be happy to answer any questions!",True,35,29,slide-010.png,5.0,"Llamas are truly remarkable creatures, showcasing a unique blend of intelligence, strength, and cultural significance. Their intelligence and curiosity make them highly trainable and inquisitive animals. In terms of strength, llamas are capable of carrying approximately twenty-five to thirty percent of their body weight, making them valuable pack animals. Moreover, sustainable llama farming has a positive community impact by supporting local economies and ecosystems. By promoting responsible llama farming practices, we not only ensure the well-being of these animals but also contribute to the vitality of local communities and the preservation of ecosystems. Thank you for your attention, and I'd be happy to address any questions you may have.",5.0,llamas.md,"Economic and Cultural Importance, Conservation Status, Diet and Digestion, Behavior and Social Structure, Health and Care","Conclusion & Fun Facts To wrap up, llamas are extraordinary animals, intelligent, strong, and culturally significant. By supporting responsible llama farming, we contribute positively to local economi...",0.7714000000000001
